,review,rating,title
61,"For some unknown reasons, the app stop recording the activity about 10 min earlier than the actual recorded time. I could find a solution to this annoying issue. Writing to support did not yet produce any result",1,App does not record exercise time correctly
62,This app recently started crashing on my iPhone. I get about 30 seconds to view my workout and then it goes off. I deleted and reinstalled but that didn’t work. My Apple Watch and phone are both updated to the newest version.,1,Crashes on iPhone 8
63,"This would be the best swim tracker app if it didn’t have so many bugs, predominant amongst them the fact that it occasionally does not save a swim workout to the Apple Workout/Health app.",3,Best swim tracker except for bugs
64,"Despite setting all my filters to the most relaxed options available I cannot find a single workout, even under the “All” screen. This seems like a pretty serious problem for an app with swim training as its raison d’être.",1,Seems to have some fundamental problems
65,Manual entry of a swim does not sync with Apple Health.  I have no issues with other health apps linking with Apple Health.,4,Manual entry does not sync
66,"The app syncs from my watch to the app about 60% of the time. 
This flaw is making it so I have to workout almost twice as much ...",3,To sync or not
67,Please make similar to Garmin in being able to do totals for month and year. Instead of us having to manually add up. Also would like cumulate to date.,1,Stats need improvement
68,I used this feature for every one of my swims and now I have to manually import. Can no longer get my splits.,2,What happened to auto imports?!?
69,I just downloaded it and I like the iPhone app but every time I try to select it on my Apple Watch it just crashes back to the app screen.,2,Not downloading correctly to watch
70,"It has been a while with the covid shut down, but the app remains clunky and it’s flexibility to provide options are limited.",2,Changes are not for better
71,Great.,5,Much better than Apple Watch native tracker
72,"I just got a iPhone XS and Apple Watch 4. The 600 yards of freestyle I did synchronized to the Apple activity app under exercises, but the 200 yards of drills I did not sync. Is this a know issue?",3,Drills not syncing to apple activity app
73,Love this app. It helps motivate me and keep me on track.,5,Love everything about app
74,However after updating to apple watch 8 it’s not importing my swims t the Apple activity tracker …..,3,This app was working great….
75,"Great app in theory, but many of my swims are not recorded, not transferring from USMS FLOG it my iWatch. No response from the company other than “watch and wait.” Needs to get more responsive and user friendly for me to up my rating.",2,Swims not transferring from USMS
76,Loved it till the latest update.  Now it just crashes when I select pebble.  Please fix pebble integration.,3,Latest update broke pebble integration
77,This app has really helped me get motivated to get back in the pool!,5,Great motivation!
78,Downloaded app and clicked on workouts and app just said “loading” forever. Then couldn’t get off app without deleting it. Tried again and it did the same thing,1,Glitch
79,"The app randomly splits pools while swimming, so the total number of pool in a swim is larger and thus the pace is faster than the actual one. I use the app with iWatch 7",2,Miss on pool counting
80,Many rhanks for the great app and all the functionalities around it! Fantastic job particularly under our COVID 19 circunstances4 congratulations!,4,Great app & swim community
81,Pebble watch no longer supported so I can no longer use this app.,3,Pebble watch no longer supported
82,Hate the new layout.  I liked the dashboard showing your average pace and last distance swum.,2,New layout needs improvement
83,"Clunky interface for starting a swim from Apple Watch. Lap counting was terribly inaccurate, for example I swam 1600y breaststroke and the app only counted 950y. The swim tracking built in to the Apple workout app has been far more accurate.",1,Cluttered and inaccurate
84,"Just got the app, found and joined my masters team. But, the workouts won’t load from the workouts page on the app.",2,"Great idea, but it doesn’t work"
85,The app randomly stooped letting me log in or create a new account even after I deleted and redownload it. Super annoying.,1,Working great and then I can’t log in
86,I love using this app in the pool. I wish they would add an open water swim tracker.,4,Love the App for the pool
87,This app is very confusing to work. I couldn’t understand how to do it.,3,Very confusing
88,"If you want to use this with other than an Apple watch, don't.  Stick with Strava.",1,I would imagine it only works with an Apple watch
89,Don’t waste your time with this App. Constant bugs render this App totally useless. It drains your phone battery and overheats the phone. There is something seriously wrong with this App. Look elsewhere.,1,Terrible App and support
90,Wish you had capabilities to sync with a FitBit Ionic. Was looking forward to using this app but my watch is not compatible.,3,No syncing with Fitbit Ionic
91,"New version.  Locked out. 

Forgot password doesn’t work.  Tried for 2 days.",1,No longer works.  Can start app or log in
92,"But it’s iffy at best 

Now it hasn’t recorded a swim since Dec 7
I have uninstalled and reinstalled. 

Went through an involved trouble-shooting a year or more ago, and it’s still hit or miss.

Wish I could depend on it.",3,I want this app to work
93,"My last name is Cumming and the dirty minded app developers have made Cumming a prohibited last name. So, I can’t participate in USMS postal swims because some prude of an app developer doesn’t approve of my last name?",1,Last name glitch
94,"Sometimes the app does not load my swim. It is not very reliable, which is too bad.",2,Sporadic
95,"I love the app,it has saved me from my home app.",5,BIM
96,"Doesn’t allow to set custom pool for those of us with exercise pools, I.e., Endless, Michael Phelps and Swimex pools - not all of us have to make turns!",3,Incomplete
97,Loved this app- tracked my swims so well- then they updated to the latest version and now none of my swims sync from my Apple Watch to the app. Horrible.,1,Update is awful!!!
98,"I have used this app and my Pebble watch for 3+ years, but today the app mysteriously discontinued providing a way to sync the app with my watch.  Bummer!  I have contacted support with no response.",1,Discontinued syncing with Pebble
99,"Won’t track different strikes, doesn’t measure correctly, and less than stellar interface",1,Junk
100,"Pretty good app. Syncing with my Garmin device finally after multiple attempts. I like the easy to read format and the ability to add a pool as well as a few other features though if I had my wishes I would request:
- my records section. I want to see my best times for different distances. It is cool to show a badge for fastest 400 yard but what is that time record? I think you can see this on the site but I could not find in app. 
- faster page load. The workouts page reloads every time I go to another part of the app and come back so it is slow. I would prefer it only loads when I come into the app and give me a refresh option ( pull down page)
- when you go into the details page for a workout it shows number of lengths and not the actual distance per session. The total shows in yards correctly. I would prefer to see my workout intervals in total yards, not lengths 
- more workouts to do. Options seem pretty limited to shorter distances. Master swim classes will do a 1650 for warm up. 
- drill videos would be cool. I know they are available through you tube but it would be cool if they were here and built into the workouts.",4,Getting there. A few more things and this would be really good.
101,Only works with Apple or Samsung watches. Doesn’t work with Garmin.,1,Didn’t work with Garmin device.
102,it’s work well even if the pool size is not standard lap.,5,good swimming app
103,Does not show up on my watch.,1,Useless
104,The app is so full of bugs it wouldn’t even download to use once. What a waste.,1,Don’t bother.
105,Be nice if it could be turned off or stopped when I’m done swimming,1,Stupid
106,"Only tracked 475 out of 800 meters interval. And the swim wasn’t saved as a workout, so it doesn’t show uo in the Activity app.",1,Inaccurate
107,I would love to use this with my Garmin watch and sync with training peaks.,1,How about Garmin
108,The app doesn’t do anything.,1,Useless app
109,Set up on Apple Watch. Swam 1700 yards in 25 yard pool and app recorded 350 yards swum.,1,Totally off
110,"THIS APP IS SO GOOD AND LITERALLY CHANGED MY LIFE 

DOWNLOAD NOW!!!",5,SUCH A GOOD APP
111,blah,1,Blah
112,"I have Apple’s new Series 2 watch. 

The positive: uses force touch to stop workout, which gets around the issue of the not very responsive wet touch screen you need to use to stop a workout in the native Apple pool swim app. The summary of the swim is good in that it attempts to breaks down a workout into swim time and rest time (but did not do so accurately).

The negatives: This app did not accurately detect stroke type. Listed everything as free. For example, I swam a continuous 400 yard warmup, mixing in different strokes. It listed everything freestyle and invented resting stops, many after a single 25 yard length, where I swam continuously.  The rest of my workout consisted of 100 yard and 200 yard free sets.  Again the app invented rest stops after many 25 yard lengths, invented a set of 225 yards. No heart beat monitor. No calorie estimate. (not really necessary but since the data is there it'd be good to incorporate). Hopefully the app will be improved, I like the concept.",2,Needs much improvement
113,"At first I was disappointed that the app didn't count my breaststroke or kick sets, but the more I use it, I see that it's algorithm is learning my strokes and adapting its analysis. All my breaststroke is now counted accurately and is starting to sometimes give me credit for kick sets. 

Even if it never quite gets the kicks counted, the ability to sense the difference between swimming and resting and the stats (some of which you can access immediately) put this app head and shoulders above the others I've tried on the Apple Watch.",4,Works well with Apple Watch
114,"Still a little buggy. I uninstalled, then reinstalled after the app crashed when I still had 20 laps to complete. It may have been the Apple Watch because the Apple logo appeared and I couldn't bring up any apps. I thought maybe the watch was downloading an IOS update or something. Whatever. It's just very frustrating. I lost all of today's data. Maybe my resistance gloves got in the way and pressed the stem. Other than that, I like this app. Some issues with lap count and stroke recognition though. Not a big deal for a casual swimmer like me.",5,Swim
115,"This app seems to have promise, but for this swimmer of quite modest abilities, it is not yet ready to replace my Garmin swim watch.

1. Accuracy. On a swim of 1300 yards, it came up 75 yards short. My Garmin has rarely missed, and then it was usually because I did something unusual like stop to adjust my goggles mid-lap.

2. Missing features. The app has no equivalent of the Garmin Drill Mode, which lets you record activities such as using a kick board and flippers. So it couldn't record several hundred yards of my workout.

3. Not optimized for interval swimming. It could figure out when I was swimming or stopped, and (usually) how long I had swum for each interval and its duration. But it did NOT give either elapsed time since the start of the last interval, or the start of the last rest period, both of which are available on the Garmin. These should be basic features of any swim  watch software.

I will watch for software updates before trying again.",3,E for effort
116,"I have just started using this new app for my swim routines and I can say that this is one of the better swim apps out there so far. I love being able to track my workouts and comparing lap times with my friends and other people who are using this app with ease. Not only that, just from using the app today, I found a few new local pools in my area that I didn't know even existed before! Now that the new Apple Watch is waterproof, this is my go-to swim app to use with it.",5,Best swim app I've used so far!
117,"I've been using this app with my Apple Watch Series 2 for about three weeks. I have not tried to get super accurate information from it, but it does a very nice job of tracking my yardage and giving me a sense of how I was performing. 

The quick drill setup on the watch is an excellent way to capture those kicking yards that don't get logged by the watch. 

Overall, I am very pleased with the app, and it seems like they keep tweaking it and making it better each time.",4,3 Weeks in and it is good
118,"Bought a new waterproof Apple Watch last week, been shopping for best swim app. My master swim mates recommended this app to me. Absolutely love it!!  Love the fact that this app not only can track my daily swim workout, but also allow me to connect with other swimmers.  The best feature is that I can locate the pool close by using this app. This is huge for me since I need to travel a lot because of work, this make my life much easier as I want to keep swimming every day.",5,Best swim app for Apple Watch so far
119,"The app is slow and clunky with an unintuitive interface. Instead of focusing on giving us quick and easy access to our swimming metrics, this app seems to instead focus more on social stuff and finding swimming pools (which it isn't very good at) and it has the word ""unknown"" misspelled as well. Building a custom workout is actually way harder and slower than it should be, plus you constantly have to wait for the app to contact the servers because no one on the development team thought people might want to store their data locally on their phone. 

It's not terrible but it certainly isn't good.",2,Slow and clunky
120,"The watch app is great. It's much more fully featured than apple's swim tracking app. 

However, the iOS software is pretty bad. The swimming stats are poorly organized, and the totals are usually incorrect. For example, any workouts from the current day don't apply to the weekly total.  Also, the charts are wrong (showing workouts which didn't occur). 

Please update the iOS app and fix the bugs!",4,Great watch sw. Poor iOS sw.
121,"Have been using this app with an Appe Watch 2.0 for a few months and have seen steady improvements in what it can do. Appreciate being able to record the skills distances within a workout now. Did have some issues with breast stroke detection, but that seems to be better after current update. Would like to see calories and sharing out from mobile app like you can in web site. Great app!",5,Works Great!
122,I had a Garmin swim before and hated constantly pressing the button to start and stop intervals. That this app automatically distinguishes between intervals and resting at the wall is the single best feature for me. This is also a big improvement over the previous version which required scrolling to see everything and crashed a lot.,5,Love the automatic interval detection!
123,"Drill feature is great, so I use this over the built in app. However anything I do fast over a 50 is counted wrong. Did last 4 times I've done a 100 fast I'll go in the 55-56 range it gives me a time of 1 minutes and says I only did a 75.  Same thing for the 200, only days I've done a 175.  Times are also off. It thinks I'm resting almost 5 seconds after I have actually finished.  Overall not terrible, drill mode is the only thing that keeps me using it since I can add back in those laps it missed.",2,Fast swimming count and times off
124,"Apple's built-in activity app is very accurate for tracking distance and deducing stroke type, but it requires manually stopping its chronometer to check time on individual sets, save or discard the record and launch a new activity before a new set. Very tedious! 

This app has been very good at stopping the clock when I come to a rest and smart enough to reset the clock to zero before I start swimming again. Big thumps up! Unfortunately, its distance and stroke count is horribly inaccurate. At the moment, I can only use it as a smart chronometer.

It also nags about gaining access to health data numerous times a day. Very annoying. Ask once and stop bothering me for at least a week. 

Hoping for the bugs to be fixed or a better alternative app to be launched.",3,Inaccurate distance tracking
125,"The Apple Watch app is very reliable for auto-detecting sets (no need to push buttons:-) and strokes. It also has a very easy way to include drill/kicking sets. 

Overall, it's a great app for swimmers!

Suggestion: While HR data from the watch is not always accurate, it would still be useful to have that displayed with the rest of the workout stats.",4,Solid performance!
126,"I really enjoy using this app with my new Apple Watch and the additional details such as split times, swimmers in my area, clubs, etc not available with Apple'a app. The UI needs a little more user flexibility as I had to contact technical support to change my location. Highly recommended, otherwise.",5,"Great App, especially with Apple Watch"
127,"This is a great app for swimming. I like that it captures my drill sets and also returns what I ""just"" swam. I gave it a four star because it's buggy and not working on my Apple Watch. I'm sure it'll get fixed quite soon. Give it a try. I won't be so quick to update, I'll wait on every other one. :)",5,Just updated and app stop working
128,"I'm happy with the app and website overall, but a few weeks ago the yards I enter in Drill Mode on my Apple Watch don't transfer to the app or website even though they show up on my watch.  It is basically a waste of time to use the drill mode since none of the yards show up.  I contacted customer service about this a few weeks ago and never heard any response.",3,"Really nice app, but drill mode still broken"
129,"I use the app frequently and all works well and great!... until... i would say about 1 out 10 swims the screen gets activated and mess up the swim tracking. My last one it wiped out the whole work out. 

So i guess you can turn on the water protection, but then you can glance during swim on progress/time/heartrate... 

Otherwise great app",4,Great swim app... BUT!
130,I didn't want to spend more money on the new AppleWatch to be able to swim. I bought a waterproof cover for my current Apple Watch and this app has helped me track my swimming. I'm also glad they added a drill component. This has been very helpful. You will enjoy this app.,5,Great Option for AppleWatch Series 1
131,"I find this app kind of spotty. For instance, it doesn't seem to capture different strokes mid workout. If I'm doing freestyle and switch to breaststroke it skips a lap or two before it picks it up. It also doesn't capture all my workouts although that could be a function of a recent update, that wiped out a couple workouts. In any case, I don't find it that much better than what Apple Watch gives you.",3,Just ok
132,"I just returned to lap swimming and tried the app. It was accurate for distance, strokes and time. I wish it showed calories burned. Are you able to run the swim app and the Apple Watch workout app at the same time? The Apple Watch workout app doesn't display different strokes, but does measure calories.",4,"Good app, but needs improvement"
133,I bought a watch specifically for the swim app and workout tracking and with every upgrade it seems to get worse. Now none of my workouts at all are displayed. Needs serious QE testing. Signed disappointed swimmer!,5,Upgrades and swim workout sync are a mess
134,"When this app is working it's Awesome! It's accurate, it's user friendly, it does everything I was looking for in a swim app. I loved it!!
That's the Good. The Bad.
Lately its crashing. I've lost two swims.. one was almost complete for 3800 yards.. the other crashed twice during my swim.
The Ugly. Your customer support is 
Horrible!! It's been over a week and I've not heard a word. Are you addressing this problem? Do you even care? I'd give this app 5+ stars. 
It's that good.. but your customer follow through is awful! Please fix!",5,"The Good, the Bad and the very Ugly."
135,"I have never felt so disappointed about an app as this one. It glitches out and doesn't record anything every third to every other time I swim. I originally got this app for the stroke count and because it could differentiate between each set. I don't know what the purpose of using it is if it glitches out so often. Rest assured it will be deleted. FYI, this week out of the 5 times I swam, it recorded 3. DISAPPOINTING",1,Extremely disappointed. Glitches out DURING swim practice every third time
136,"Pebble Time works great to track your distance during the workout. But syncing the Pebble to the app is Russian roulette. Every few work outs it will not only NOT sync the work out but will delete the workout too! Really frustrating when you are trying to track progress and use goals to motivate.

Really disappointed that they couldn't get this fundamental part of the whole app sorted out by now!",2,App sync is spotty at best!
137,"After using this app for about a month, ~ 3 times a week, all performance measures noticeably improved. This has also reflected in swim style improvements that my co swimmers noticed. 

Highly recommend to all skill level swimmers.",5,Love this app - best for swimmers 👍👌👆
138,Got my workout exactly right even the first time. Apple's workout app never did no matter what I tried. Allows to edit workout if needed (I could remove my experimental drill). Amazed!,5,WAY better than native workout app
139,"Since getting the new waterproof Apple Watch, I have been searching for a great swim tracking app.  This looked like it might be the one - until I discovered that there is. I way to tell the app about pools that it does not already recognize.  I swim in my own pool, and that means I am out of luck.  Seems like a very silly omission.",3,Really wanted to like this
140,"I love the app, but consistently run in to issues with the app closing part way through my swim. This make it difficult to accurately track my workouts. 

I am running this on a 1st generation AppleWatch with a Catalyst, waterproof watch case. 

Hope they can create a more stable app.",4,Best Swim App so far
141,Drill mode and send off timer took a bit of time to get use to but this has become my go to app for my swim workouts.  Best app I have found for Apple Watch for tracking Swim workouts.,5,Works as expected
142,"I have been using MySwimPro since mid Janurary 2017. I am 64 years old and use it daily from my Apple Series 2 watch. It does all I need it to do and I am sure more. I just needed it to count my laps but I can see other great information like elapse time, calories and pulse. I love this app.

I have not tried all the other great parts of the app. 

The support is excellent. I had a few questions and Adam Oxner replied that day. There was an app fix the next day. 

Thanks MySwimPro team.",5,Great swim tracker
143,"Great new app. As someone who loves swimming I appreciate having this new app a lot. The app is great but definitely needs some improvements.
Since this is a new app I am giving it 5 stars and will be waiting for new releases.",5,Love it
144,"Apple watch app froze the second time I used it, requiring me to uninstall and reinstall (which deleted my swim.) When I tried to add the work out manually, it required the facility (why?) but didn't have the facility in its database. All that said, it is a free app so you get what you pay for.",3,Not quite ready for prime time
145,Counting laps was a pain and I would always loose my count in reaching my goal each day. Now with this app I don't have to worry about it as it know exactly where I am and how much I have done.,5,Amazing
146,"I use this app all the time and really like it. The stats, number of laps, heart beat rate, everything gets counted. I only wish #of strokes would get back, disappeared after the update.",5,Great swimming app
147,This app works great! I have had no issues uploading all of my workouts from my Garmin swim watch. I also like being able to connect with the other swimmers in my club.,5,Great Swim App!!
148,"As a triathlete, this app allows me to track every single workout and is providing me with the details I need to check on my improvements. Highly recommended",5,Love it
149,"This app works great for my Apple Watch 2 for capturing all my swimming data, including drills when I'm not moving my arms. I like the detailed data breakdown, workout analysis, and accurate lap count.",5,Great Workout App
150,"The interface and ability to record kick sets held a lot of promise. But, alas, during my first workout the app recorded 175 yards for my 400 yard warmup. It was flummoxed by my 100 IM, recording only 25 yards... I switched mid workout to the native activity/swim app and it accurately counted the rest of my workout. 
I'll be deleting this app. Maybe they will improve in the future. 
Also I am concerned that it does not water lock the watch.",1,Not accurate
151,"Great app, very well-rounded. One of the best feature is the pool finder and seeing other people tracking their progress. Tried some other apps and like this one the best.",5,Love the pool finder feature!
152,"I've only used this app a couple of times, but so far I love everything it does. Very easy set up and use during my workouts. Check it out!",5,Awesome swim app
