,review,rating,title
228,"***Update - 02-10-2017
More updates have been made and there have been a couple of improvements that I would like to mention. I have also increased the rating from 2 stars to 3. 
The first update was the addition of the countdown timer. This allows me to set a time to do repeated sets on. Ideally I would be able to input an entire workout and it would guide me with what the next set is to be and when to start and how long to take, but this is still very helpful. One improvement would be if it was able to give a 5 second haptic countdown before haptically buzzing on the set off time. But that is nitpicking. 
Secondly, they have added the ability to chose workouts on the app. I like where this is going, but haven't had success in tailoring a workout to exactly what I am looking for on my pace. And if it cannot be uploaded to the watch to be my guide then there is no point anyways. 
Third, the ability to edit the results of a workout on the phone app is great. 
The app now seems better able to determine what strokes I am doing. 
One problem that still remains, and it is a big one, is the accuracy to determine starting and stopping. It is still way off, and this makes knowing your real pace impossible, and even trips some segments to stop while you are actually just in your streamline kick after a turn.
But all in all, it seems to be improving. 

***Update - 12-19-2016
After a few updates there has still been no progress made in improving the accuracy. Consistently now it improperly guesses the stroke type of my first warmup lap and short changes me by 25 yards. And the 5-10 second lag to start and stop hasn't improved either.

While this app may be the best swimming app out there, I am overall regretting getting an Apple Watch series 2 to use for swimming. 

***Original review:
When I started to research smart watches to pair with my iPhone one of the main features that I was looking for was a good swimming app. I wanted the ability to program it with a swimming workout and have it track my distance and pace and countdown when to start the next interval. For some reason, I thought this app would do this, and so I bought an Apple Watch. Unfortunately, this app does not do this.

So what does this app do? When you are about to get in the pool you pull up the app on your watch and you select start workout. It then records when you are swimming and when you are resting. At the end of the workout you select end workout.

Once you are done you can go to the app on your phone or you can log into your account on a computer. From there you can see all of your intervals broken down by individual lengths of the pool with the time, your pace/100, stroke count and some other metrics. It even guesses which stroke type you are doing. 

So even without having the app be able to guide a workout, I would probably give it 3.5 stars. I would give it 4 if they would add the time of day to each segment as well as this can be useful later. 

Why then do I give it 2 stars? Because it isn't very good at knowing when you stop and start an interval. It's off by 5-10 seconds at each end. This makes it useless if you are doing sets of short distances. I am sincerely hoping that this is a problem of the app software and not of the Apple Watch hardware. One of the features of their website is even your fastest 50 freestyle. I don't know why they would have this feature if the accuracy is 5 seconds off on a 25 second distance.

Other problems that I have noticed are that sometimes it mistakes which stroke a length is, and sometimes it will register 50 yards as only 25.

So for now it gets 2 stars. It works as an app that almost records how far I swim in a given workout. Beyond that is sketchy at best.",2,Great Concept. Poor Execution.
229,App.has gone from functional to brick. Says it cannot connect to server.,2,Dead app
230,"It's January now and I haven't been able to sync between my Pebble and this app since August, and I've tried all kinds of gyrations to try and get them to sync. Now it is much WORSE. I just updated the Pebble part of the Swim duo and it has completely taken over my watch. I kill the swim app and it comes back before I can get to any other menu item, so I can't even reboot the watch. And this version still asks to be made my Activity app every.single.time.it.runs no matter that I keep saying no. If it was a person, we would call that a Narcissistic Personality Disorder. The ONLY reason I keep using is because the stopwatch digits are big and easy to read while I'm in the pool and not wearing my glasses.",1,Poor experience with Pebble
