,review,rating,title
175,"Having used the Apple Watch app and now the Swim app, there is no comparison. Fantastic, easy to use and accurate.",5,Best on market
176,Great app! Developers did a nice job at making this app flow beautifully on the apple watch.,5,Super easy and functional
177,"UI needs a little work, but it's the most accurate tracker of distance out of all apps I've used. It's made my new Apple Watch so much more useful for me.",4,Great app!
178,"Enjoy using this tracker for my daily swims.  Like the data set shared between the app, my Apple Watch and the Health app on the iPhone.",4,Enjoy the product paired with Apple Watch
179,"Love this app for my triathlon training when I'm in the pool. Stroke rate, Swolf, distance per 100. It has everything.",5,Best swimming app for Apple Watch
180,I'm new to swimming and this app is great to track workouts. Wearables are a huge plus when paired with this app,5,Great app
184,I use it with the Garmin Fenix 3 and found it accurate,5,Works well with Garmin watch
185,Nice app! I like the social aspect and can't wait to get in the pool and start logging work outs.,5,Exciting
186,I really enjoy tracking my progress and mileage.,5,Lap swimmer
187,Pretty accurate swim tracker.  Gets the job done.,5,Great Tracking App
188,Love this app on my Apple Watch as it does not stop every time I lift my arm !!,5,Great app
189,User friendly and very helpful! High five!,5,Great App even for beginners!
191,App works great with the new Apple Watch. Stoked,5,Works on the new Apple Watch
194,"Is a free app, detects the strokes (most of the times) detects the distance, and again... is free! Love it!",5,Excelent!
196,Much better than swimpro,5,Great swim app
198,I love this app! It does so much in recording my swims,5,Great Swim App
200,"This one tracks your distance, time and heart rate. The open water course is still a mess of spaghetti due to GPS  issues but still superior to the native Apple Watch program for open water. Pool swimmers will appreciate the workouts. It is FREE! If the GPS improves would rate 5 stars. All in all I really appreciate this app. Thanks to the swim.com team!",4,Open swim better than Apple Watch
205,It is reliable and fun to use.,5,I love it :)
211,Good for me,5,Swim
212,Great,5,Great
215,"I’ve been using the swim.com app for more than a year and I like it a lot. There are however, a few points that could be improved:
- Workout management - I constantly have issues with my workouts. They disappear from my favorites, I lose my edits and they get messed up on my Apple Watch. 
- It would be great if it was possible to create/edit workouts on a browser instead of being limited to the app. 
- On many occasions my Apple Watch loses track of my laps, adding extra yards or not counting a lap. 
- The guided workouts (I know it is an experimental version yet) could be improved. Sometimes the intervals are not recorded and it would be useful to have a way to view the next interval. 

In general it is a pretty cool app and I’ll definitely keep using it!",4,Nice app but still needs some bug fixes
220,"This is the best lap tracker I’ve found, however, there’s one annoying thing about its integration with the phone’s activity app:  after finishing a morning swim, my watch will say I’m at like 800 calories in the movement ring, but if I view my swim details on my phone’s Swim.com app, the total calories for the swim suddenly drop to about 200 calories.  I’m fairly certain the 800 cal is accurate for a 50 minute hard swim.

A feature that would be great to add is an interval timer, that can be viewed during the interval swim.  It’s nice to view an interval when resting afterwards by swiping left, but it would be really nice to see the interval’s progress when glancing at the watch during a turn.  The total swim time is kind of worthless, imho.

Thanks.",4,Excellent app except for a couple of things
222,Good. Never opened or used but I rlly love it BEST APP EVER !!,5,Yay SWIM.com
223,I am getting into swimming and I love the Swim.com Leaderboards. I also tried other apps but the swim tracking was not as accurate as Swim.com’s proprietary tracking algorithms. Love it!!,5,The best swim tracking app!
