,review,rating,title,keywords_by_method1,keywords_by_method2
0,"I like sport gadgets, but usually 9 out of 10 times my enthusiasm ends in great disappointment. However, the Form swim goggles have by far exceeded my expectations - they simply work. All the features advertised work better than expected and the app is a solid companion of the goggles. If you want to focus on your swim and forget counting laps or looking up for your time, the Form swim goggles are the best solution. They are also for me personally one of the best fitting goggles I’ve ever used, but that might be different for others people. I am really grateful for the team having developed these goggles. I wish more people knew about them. They are now also sold in Europe, but I was able to order them from the US.
P. S. : last week I tried out the new open water feature after a firmware update. I connected my Form goggle with my Apple Watch series 4 and went for a first swim. Once again, it all worked as announced. Just as a suggestion, I really wish that the developers could use Apple Watch’s inbuilt compass to show the direction of my swim on the display too. It’s my only future feature request!",5,Amazing! Now even better 😃,"['Form swim goggles', 'sport gadgets', 'great disappointment', 'enthusiasm ends', 'ends in great', 'Form swim', 'Form', 'Apple Watch', 'goggles', 'swim']","['swim goggles', 'apple watch', 'form goggle', 'companion goggles', 'fitting goggles', 'goggles best', 'sport gadgets', 'goggles ve', 'goggles', 'goggles wish']"
1,"My biggest question was if I was going to be able to read the data without my glasses and can tell you No problem as the data is easy to read and very clear in my vision. 

I have recently started running Triathlon events and was struggling with the swimming portion. I have been looking into Form goggles for a while and decided to purchase them as I do all my swimming in open water. My first impression is they were very easy to set up and connect to my Garmin 745 watch. After several swims I can already see they are helping me swim farther by knowing the distance I have covered as well as time length and pace of my swim. I set a goal of distance and/or time I want to swim and now I know when I have completed my goal. 

Another benefit to me is the fact that in open water lake swimming I can’t see the bottom so it was like swimming in the dark whenever face was in the water and now I focus on the data which is very easy to read.",5,Very motivating,"['biggest question', 'started running Triathlon', 'running Triathlon events', 'easy to read', 'swimming', 'running Triathlon', 'Triathlon events', 'easy', 'open water', 'recently started running']","['form goggles', 'goggles decided', 'goggles', 'data glasses', 'glasses tell', 'glasses', 'watch swims', 'focus data', 'swimming dark', 'clear vision']"
2,"This has been a game changer in how I swim. First, the app is great and is the required companion for the Form goggles. The goggles are amazing and after almost half a year of reliable swim tracking in the mornings and at night, I love these goggles and the app. They are fast, reliable, the screen is clear underwater and gets out of the way. Most importantly it lets me enjoy my swims without counting in my head and lets me have the data to know how I am performing and set timing goals to improve. I don’t know how it knows my stroke type, but again these goggles and the app are magic and I highly recommend them both!",5,I love these goggles,"['game changer', 'Form goggles', 'goggles', 'app', 'reliable swim tracking', 'game', 'changer', 'swim', 'reliable swim', 'required companion']","['swim tracking', 'goggles app', 'swim app', 'type goggles', 'form goggles', 'reliable swim', 'swims counting', 'goggles goggles', 'stroke type', 'love goggles']"
3,"The googles are fine and the workout generation is fine. However, something as basic as pausing your workout plan or being able to go back and pick up in you plan where you left off is not possible. If, for whatever reason, I don’t have the ability to complete 3 swims a week for 8 weeks, I should be able to go back to the last swim I completed and start from there. The progression system is time locked like an AFK video game. There’s no reason that I should have to wait 7 days for a workout week to unlock and then not be able to go back and complete missed workouts. Part of this is building endurance or achieving a goal set in the plan and if I don’t take the proper steps of progression then I don’t get as much out of week 7 as I could if I left off on week 3 This seems like a HUGE miss on their part and completely neuters an entire aspect of what could make this set up great.",3,"It’s fine, but not revolutionary","['workout generation', 'googles are fine', 'generation is fine', 'fine', 'back', 'workout', 'week', 'n’t', 'plan', 'googles']","['pausing workout', 'workout generation', 'workout week', 'missed workouts', 'swims week', 'complete swims', 'start progression', 'workout plan', 'progression time', 'week unlock']"
4,"This and bone conduction headphones have me swimming 2-3 times a week. The workout planner is awesome - it keeps it interesting. 

My feature request to the developer - please allow setting a critical swim pace, and allowing the workout builder to set intensity based on that, so that in the pre set instructions it can give a time per lap to shoot for. Or even allowing custom notes where I could enter that. 

Thanks for a game changing product!",5,Made me fall back in love with swimming,"['bone conduction headphones', 'bone conduction', 'conduction headphones', 'times a week', 'week', 'swimming 2-3 times', 'bone', 'conduction', 'headphones', 'swimming']","['workout planner', 'workout builder', 'swim pace', 'allowing workout', 'swimming times', 'headphones swimming', 'critical swim', 'swim', 'swimming', 'week workout']"
5,"I love the product and app. Everything is done very well and I can’t imagine my life without the googles. Some reviews claim that this product should be for serious swimmers. I am a terrible form, overweight guy trying to lose 100 pounds and this app and googles have already made a big difference and I’m swimming longer. So thankful for this product. It is for everyone!",5,Great product and app one suggestion,"['product', 'love', 'app', 'love the product', 'googles', 'n’t imagine', 'imagine my life', 'reviews claim', 'terrible form', 'overweight guy']","['app googles', 'googles reviews', 'product swimmers', 'product app', 'app', 'pounds app', 'app imagine', 'swimmers terrible', 'swimmers', 'love product']"
6,"I love these goggles so much, but when it comes to charging them the goggles won’t charge well. I’ll put them on the charger and the red light comes on. I’ve tried to fix this issue by rearranging the way the charger connects to the goggles, but the light stays red except for some spots that are green. The problem with this is that the goggles are never guaranteed to be charged when I leave them with a green light. I understand that the goggles are new and still working through updates and I really appreciate what this company has done for swimming!",4,Charger problems,"['n’t charge', 'goggles', 'light stays red', 'light', 'red light', 'love', 'charging', 'n’t', 'charge', 'charger']","['charging goggles', 'goggles light', 'charger red', 'problem goggles', 'goggles new', 'love goggles', 'charger connects', 'connects goggles', 'understand goggles', 'goggles guaranteed']"
7,I don’t understand their pricing but right now I don’t care because I like this app and my goggles so much. It was always so annoying to me to have to remember my labs. How to stop and click a clicker or write something down.  No more. I just swim. I just got the polar optical sensor I haven’t quite figured out how to connect it but when I do I may write more,5,Just the best deal going,"['understand their pricing', 'n’t understand', 'n’t care', 'n’t', 'understand', 'pricing', 'care', 'app', 'goggles', 'remember my labs']","['pricing', 'understand pricing', 'app goggles', 'pricing right', 'goggles annoying', 'app', 'goggles', 'sensor', 'sensor haven', 'like app']"
8,"After admiring them for awhile, I’m very grateful to have been gifted a pair of Form goggles by my teammate. I’m fascinated by all the metrics available upon synching and am very happy with the very user friendly interface!  I really look forward to learning more about my swims afterwards as well as seeing the real time info available as I swim!!!",5,Excellent,"['pair of Form', 'Form goggles', 'gifted a pair', 'user friendly interface', 'Form', 'awhile', 'teammate', 'friendly interface', 'admiring', 'grateful']","['form goggles', 'goggles teammate', 'goggles', 'learning swims', 'metrics available', 'available swim', 'swims seeing', 'form', 'fascinated metrics', 'metrics']"
9,"I was really disappointed to learn the collected data from the Form Goggles cannot be pushed to Garmin Connect. Form should take a look at how Zwift (for cycling) does it because it cannot be that hard!

UPDATE:
Response from Form: “Unfortunately this is due to a limitation from Garmin's side and we are not able to send them our data.”

My Response:
First, thank you for responding, it shows Form cares about customer satisfaction. However, Zwift (and I’m sure others) seems to send data to Garmin Connect just fine, how is this Garmin’s limitation? 

BTW, I’ve been a developer for 25 years so I can understand technical limitations between disparate systems but if other platforms are pushing data to Garmin, the problem is most likely NOT them.",3,Doesn’t Push Data to Garmin Connect,"['Form Goggles', 'Garmin Connect', 'disappointed to learn', 'learn the collected', 'Garmin', 'Form', 'Goggles', 'pushed to Garmin', 'data', 'Zwift']","['garmin connect', 'data garmin', 'garmin', 'garmin limitation', 'garmin problem', 'garmin able', 'limitation garmin', 'connect form', 'pushed garmin', 'fine garmin']"
10,I love the idea behind this as it records your laps and swims and just the rest timer itself is awesome just to keep you on schedule with your workout.  What I really wish for is a current lap timer during your swim.  I have the settings to have it turned off mid lap then just flash split times after the turn.  But seeing the time of the current lap I feel would be a big motivator and helpful to keep you on pace,4,Really good googles and app,"['love the idea', 'rest timer', 'current lap timer', 'current lap', 'lap timer', 'lap', 'workout', 'timer', 'love', 'idea']","['lap timer', 'timer swim', 'timer awesome', 'swim settings', 'records laps', 'rest timer', 'current lap', 'timer', 'laps swims', 'laps']"
11,"Goggles/software do function well and as advertised. However, subscription price for workouts in addition to the high initial cost of buying their product is a slap in the face. Almost every other sport tracking wearable gives you the ability to integrate workouts with no extra cost. I will stick to manually performing workouts with the unsubscribed version until they break, then likely seek a different brand.",3,Subscription??,"['software do function', 'Goggles', 'software', 'advertised', 'workouts', 'high initial cost', 'function', 'subscription price', 'cost', 'high initial']","['goggles software', 'tracking wearable', 'goggles', 'sport tracking', 'integrate workouts', 'price workouts', 'wearable gives', 'software', 'workouts unsubscribed', 'wearable']"
12,If a user can estimate their DPS (distance per stroke) in the settings it would be possible to calculate distance swam in open water setting without GPS since Form already calculates stroke rate. Understanding that this is all estimated... it is a motivation tool for a swimmer.  Swimming with a watch is annoying and I will never do it. That is why I bought Form. Would be cool to see an estimated distance so I don’t have to do the math myself.,4,Open Water distance swim without GPS,"['calculates stroke rate', 'open water setting', 'estimate their DPS', 'stroke rate', 'calculate distance swam', 'setting without GPS', 'user can estimate', 'swam in open', 'open water', 'water setting']","['distance swam', 'distance stroke', 'swimming watch', 'gps form', 'estimated distance', 'dps distance', 'calculates stroke', 'calculate distance', 'gps', 'stroke rate']"
13,"I bought the goggles for the real-time telemetry.  The true potential was the workouts.  I stay engaged and improving without boredom.  I use a plentiful variety of structured workouts that use drills, equipment and just plain fun to pour on the power!  My times are improving too.",5,Unlock Your Potential!,"['real-time telemetry', 'bought the goggles', 'telemetry', 'bought', 'goggles', 'real-time', 'true potential', 'workouts', 'improving', 'structured workouts']","['potential workouts', 'workouts use', 'goggles real', 'bought goggles', 'goggles', 'structured workouts', 'workouts stay', 'workouts', 'time telemetry', 'telemetry']"
14,"I have these googles and they are pretty neat.  I’m fortunate to be grandfathered in and the workouts features are nice.  I’m very disappointed that Form decided to move to a subscription model for any future users.  You CAN NOT use these goggles without a subscription now.

The subscription is on par with the cost of a Peleton subscription and more than Zwift or Wahoo Systm, and provides way less value.

See below the email I received from FORM.

If you purchased your goggles before May 26, your FORM experience won't change. But we wanted to let you know what's changing for swimmers who purchase after May 26. Real-time metrics in pool, open water, and swim spa are now part of the FORM membership. New swimmers will be required to have an active membership to access this and all member features.",1,Buyer Beware - Subscription Required to Use Goggles,"['pretty neat', 'Form', 'subscription', 'Wahoo Systm', 'Zwift or Wahoo', 'neat', 'googles', 'pretty', 'Peleton subscription', 'goggles']","['goggles subscription', 'purchased goggles', 'swimmers purchase', 'peleton subscription', 'subscription', 'workouts features', 'subscription subscription', 'subscription zwift', 'grandfathered workouts', 'decided subscription']"
15,These goggles are fantastic and the app is the perfect complement. It lets me dig into my swim data to track my performance improvement. The app is well laid out and intuitive and allows you to share workout data among friends.,5,Great new product for swimmers,"['perfect complement', 'goggles are fantastic', 'complement', 'app', 'goggles', 'fantastic', 'perfect', 'performance improvement', 'data', 'track my performance']","['fantastic app', 'app', 'improvement app', 'goggles fantastic', 'swim data', 'goggles', 'app perfect', 'workout data', 'data track', 'app laid']"
16,"I have been using the goggles regularly for both pool and OW swims. Both with Apple Watch and Garmin connect as the goggles when used for OW simply function as a display while the Watch control the recording and swim.

1. Current pace not available, only average page for entire workout
2. HR displayed after pausing workout is wrong, both in FORM app and goggles. Heart rate shown is 20 BPM above actual rate and when examine using the FORM app the entire second half of the swim has HR increased by 20 BPM compared to first half.

In short totally unreliable data.

Furthermore this kind of errors are obvious software bugs and reveals that the goggles have not been tested properly when used for OW swims.

The only thing the goggles can be used for during OW swim is to display the total distance.",1,Unfinished product with serious shortcomings,"['Apple Watch', 'goggles regularly', 'goggles', 'FORM app', 'Watch control', 'Watch and Garmin', 'Watch', 'Garmin connect', 'swim', 'FORM']","['app goggles', 'goggles tested', 'goggles heart', 'swim hr', 'connect goggles', 'recording swim', 'apple watch', 'using goggles', 'watch garmin', 'goggles used']"
17,"Compared to regular swim googles these googles reduce your vision by about 50 percent. That’s a big trade off to have have data that is available, slightly delayed, from other sources like Apple Watch and and pool time clocks.  Open water swimming requires navigation and spotting landmarks.  This is extremely difficult with the tunnel vision and smoked tint of these google.  Feels like you are swimming in a cave.  Fit is average as the googles can be worn with either side up which is sub-optimal for a good fit.",1,Wait for later generations,"['Compared to regular', 'regular swim googles', 'regular swim', 'Apple Watch', 'percent', 'sources like Apple', 'swim googles', 'googles reduce', 'Compared', 'pool time clocks']","['swim googles', 'googles worn', 'swimming requires', 'regular swim', 'water swimming', 'swimming', 'swim', 'like swimming', 'average googles', 'tint google']"
18,"The googles are great! The app is also clean and easy to use. However, as a competitive swimmer many of the workouts are very simple. I would like the ability to create my own workouts so then I have complete control on the workouts and then could align with my workout schedule.",3,Needs the Ability to Create Custom Workouts,"['googles are great', 'great', 'workouts', 'googles', 'clean and easy', 'workout schedule', 'competitive swimmer', 'app', 'clean', 'easy']","['create workouts', 'control workouts', 'workout schedule', 'swimmer workouts', 'align workout', 'workouts simple', 'workouts align', 'great app', 'ability create', 'workouts complete']"
19,"Form is the best in swimming metrics. The display quality and comfort of the googles are uniquely awesome, as well as the app! The only missing feature to be able set a certain distance to reach for the ability to count down and show the remaining distance. This is a base for a long distance swimmer.",4,Awesome with a small miss,"['swimming metrics', 'Form', 'metrics', 'uniquely awesome', 'distance', 'swimming', 'display quality', 'quality and comfort', 'googles are uniquely', 'long distance swimmer']","['swimming metrics', 'distance swimmer', 'best swimming', 'metrics', 'swimmer', 'swimming', 'metrics display', 'form best', 'distance reach', 'awesome app']"
20,"These puppies are amazing! The AR display helps me track my laps and splits and times and distance and calories. WHILE I swim! It’s amazing and I love them. Plus, their customer service is excellent. 10/10 thank you FORM! Legiiiiiit.",5,Will Never Swim Without My FORM Goggles!,"['puppies are amazing', 'distance and calories', 'puppies', 'track my laps', 'laps and splits', 'splits and times', 'times and distance', 'amazing', 'FORM', 'calories']","['swim amazing', 'puppies amazing', 'laps', 'laps splits', 'puppies', 'ar display', 'helps track', 'track laps', 'swim', 'track']"
21,"I use a Garmin watch and Garmin connect to track my swims. Form will retrieve my data from the watch but if I just use the goggle data it won’t interface with Garmin connect. Also I accidentally deleted a swim and there is no way to re-retrieve the data or copy yesterday’s swim. It’s a new app so I get it. The goggles are awesome, clear and informative.",3,Can only get better,"['Garmin connect', 'Garmin', 'Garmin watch', 'connect', 'connect to track', 'data', 'watch', 'track', 'interface with Garmin', 'watch and Garmin']","['garmin connect', 'garmin watch', 'interface garmin', 'goggle data', 'watch garmin', 'app goggles', 'use goggle', 'use garmin', 'garmin', 'goggle']"
22,The app is good: responsive and user friendly.  It’s great to see all the stats in one place as well as all of my workouts. Video tutorials of the drills are also very helpful,5,Love it so far,"['app is good', 'responsive and user', 'user friendly', 'good', 'responsive', 'friendly', 'app', 'user', 'Video tutorials', 'workouts']","['app good', 'app', 'workouts video', 'place workouts', 'drills helpful', 'tutorials drills', 'tutorials', 'user friendly', 'video tutorials', 'drills']"
23,"I was a bit skeptical about these goggles and did not believe the hype, then I tried them. Wow, what a remarkable change to my training and focus. I love them.",5,"Wow, what a game changer","['bit skeptical', 'hype', 'training and focus', 'bit', 'skeptical', 'goggles', 'remarkable change', 'Wow', 'focus', 'remarkable']","['skeptical goggles', 'goggles did', 'goggles', 'training focus', 'focus', 'focus love', 'remarkable change', 'change training', 'believe hype', 'skeptical']"
24,I am enjoying the glasses and app.  Joining is too expensive considering I had to buy the goggles and already pay for pool time. Will hold on that for now,5,review,"['glasses and app', 'enjoying the glasses', 'app', 'pool time', 'enjoying', 'glasses', 'buy the goggles', 'pay for pool', 'Joining', 'time']","['glasses app', 'buy goggles', 'goggles pay', 'app joining', 'enjoying glasses', 'joining expensive', 'glasses', 'goggles', 'joining', 'app']"
25,"Please let me have more stats on real time like I can choose for turn and rest.

Thanks!",5,Great! Plus Feature request,"['turn and rest', 'stats on real', 'real time', 'choose for turn', 'rest', 'stats', 'real', 'time', 'choose', 'turn']","['real time', 'choose turn', 'turn rest', 'stats', 'let stats', 'turn', 'stats real', 'time like', 'rest thanks', 'time']"
26,Cannot wait to monitor my heartbeat live. Thank you Form Team.,5,When are we getting the new version compatible with Polar OH1+?,"['heartbeat live', 'Form Team', 'wait to monitor', 'monitor my heartbeat', 'live', 'Team', 'wait', 'monitor', 'heartbeat', 'Form']","['monitor heartbeat', 'heartbeat live', 'heartbeat', 'wait monitor', 'live thank', 'live', 'monitor', 'thank', 'thank form', 'team']"
27,There is no app support. Multiple attempts at contact have gone unanswered for weeks. No ability to create your own workout and download to goggles. Have to join a subscription service for workouts. There are some included with the app but seem ti be geared to the novice swimmer.,1,No support,"['app support', 'support', 'Multiple attempts', 'unanswered for weeks', 'attempts at contact', 'app', 'download to goggles', 'Multiple', 'weeks', 'ability to create']","['app support', 'included app', 'app', 'workout download', 'app ti', 'download goggles', 'create workout', 'workouts included', 'novice swimmer', 'service workouts']"
28,Form goggles are awesome.  Takes your swimming to a whole other level! And their customer service is top notch.,5,Awesome goggles!,"['Form goggles', 'goggles are awesome', 'Form', 'awesome', 'goggles', 'level', 'notch', 'swimming', 'customer', 'service']","['form goggles', 'goggles awesome', 'goggles', 'form', 'swimming level', 'takes swimming', 'swimming', 'awesome takes', 'service notch', 'takes']"
29,"Love the new graphs in the app, and excited to try out some of the new dashboard options",5,Great update!,"['dashboard options', 'Love', 'app', 'options', 'graphs', 'excited', 'dashboard']","['dashboard options', 'graphs app', 'new dashboard', 'new graphs', 'dashboard', 'app excited', 'graphs', 'app', 'love new', 'try new']"
30,This app is an unexpectedly amazing bonus to using the FORM Swim Goggles.  It feels like Strava for swimmers.  Nice work to all the developers who put this together.  👌,5,Serious Amazing App,"['FORM Swim Goggles', 'Swim Goggles', 'FORM Swim', 'unexpectedly amazing bonus', 'unexpectedly amazing', 'amazing bonus', 'Goggles', 'FORM', 'Swim', 'Strava for swimmers']","['swim goggles', 'strava swimmers', 'goggles feels', 'goggles', 'form swim', 'app', 'strava', 'swimmers nice', 'like strava', 'swimmers']"
31,"So cool to get a quick in depth review of a swim. Broken down by stoke, stroke count, and interval!!!
Not to mention the exact rest interval, without ever looking at the clock!!!!",5,Form rocks,"['quick in depth', 'depth review', 'swim', 'stroke count', 'interval', 'cool', 'quick', 'depth', 'review', 'rest interval']","['review swim', 'swim broken', 'swim', 'stroke count', 'stoke stroke', 'quick depth', 'depth review', 'clock', 'rest interval', 'looking clock']"
32,Going to have to share this with our other alumni swimmers. Great product! App is cool too.,5,Finally!,"['alumni swimmers', 'swimmers', 'Great product', 'share', 'alumni', 'App is cool', 'Great', 'product', 'App', 'cool']","['alumni swimmers', 'swimmers great', 'product app', 'app cool', 'swimmers', 'great product', 'app', 'share alumni', 'alumni', 'going share']"
33,Never could keep track of laps and stats. These goggles help me know where I am at and keeps me motivated.,5,Newbie,"['laps and stats', 'track of laps', 'stats', 'track', 'laps', 'motivated', 'goggles']","['stats goggles', 'laps stats', 'track laps', 'goggles help', 'laps', 'goggles', 'track', 'keeps motivated', 'stats', 'motivated']"
34,Paired easily with my goggles.  Syncs fairly quickly.  The data is rich and useful.  Helps round a pretty damned strong training experience with the form goggles,4,Straightforward data driven app,"['Paired easily', 'Paired', 'Syncs fairly quickly', 'goggles', 'easily', 'Syncs fairly', 'fairly quickly', 'Syncs', 'quickly', 'form goggles']","['goggles syncs', 'form goggles', 'syncs fairly', 'syncs', 'easily goggles', 'goggles', 'paired easily', 'paired', 'quickly data', 'data rich']"
35,These goggles are great motivation to get to the pool and get fit.  Great value. Great support.   Changed swimming for this 67 year old.,5,Great Swim Coach,"['great motivation', 'fit', 'great', 'goggles', 'motivation', 'pool', 'goggles are great', 'Great support', 'support', 'Changed']","['goggles great', 'goggles', 'pool fit', 'swimming 67', 'changed swimming', 'motivation pool', 'swimming', 'motivation', 'great motivation', 'pool']"
